{
  "status": "completed",
  "results": {
    "nums": [1, 2, 3, 4, 5],
    "doubled": [2, 4, 6, 8, 10],
    "evens": [2, 4],
    "total": 15,
    "sorted": [1, 3, "a", true, null],
    "rev": [5, 4, 3, 2, 1],
    "uniq": [1, 2, "2"],
    "sl": [2, 3, 4],
    "fl": [1, 2, 3, [4]]
  },
  "execution_order": ["nums", "doubled", "evens", "total", "sorted", "rev", "uniq", "sl", "fl"],
  "skipped": [],
  "error": null
}
