{"status":"completed","results":{"f1":[1,3,5],"f2":[2,3],"f3":[1,"x",[1],{"a":1},true],"f4":["apple","pear","plum"],"fl":[1,2,3,[4],"x"],"mixed":[3,"b",true,null,[1],{"z":1},2.5,"a",false],"mp":[-1,-2,-3],"mp2":[10,20,30],"mp3":["1","\"x\"","null"],"mp4":["number","string","null"],"mp5":[{"k":true},{"k":true}],"rev":[false,"a",2.5,{"z":1},[1],null,true,"b",3],"sl":[3,4],"sl2":[2,3],"sl3":[0,1,2,3],"sl4":[],"sorted":[2.5,3,"a","b",false,true,null,[1],{"z":1}],"uniq":[1,"1",[1],{"a":1},null]},"execution_order":["mixed","sorted","rev","uniq","sl","sl2","sl3","sl4","fl","mp","mp2","mp3","mp4","mp5","f1","f2","f3","f4"],"skipped":[],"error":null}
