{"status":"completed","results":{"raw":[3,1,2,1,[4,5],null,"b","a",true,false],"sorted":[1,1,2,3,"a","b",false,true,null,[4,5]],"flat":[3,1,2,1,4,5,null,"b","a",true,false],"uniq":[3,1,2,4,5,null,"b","a",true,false],"picked":[3,1,2,1],"sliced":["b","a",true],"reduced":107,"reversed":[1,2,1,3]},"execution_order":["raw","sorted","flat","uniq","picked","sliced","reduced","reversed"],"skipped":[],"error":null}
