{"status":"completed","results":{"cmp":true,"eq":true,"flat":[1,2,3,[4]],"mixed":[3,"b",false,null,[1],{"k":1},1,"a",true,[0],{}],"rev":[{},[0],true,"a",1,{"k":1},[1],null,false,"b",3],"slice1":[2,3],"slice2":[3,4],"sorted":[1,3,"a","b",false,true,null,[0],[1],{},{"k":1}],"uniq":[1,"1",null]},"execution_order":["mixed","sorted","rev","uniq","slice1","slice2","flat","cmp","eq"],"skipped":[],"error":null}
